{
  "schema_version": 2,
  "run_id": "T-9011-evidence-execution-20260903T003052Z",
  "task_id": "T-9011",
  "started_at": "2026-09-03T00:30:30Z",
  "ended_at": "2026-09-03T00:30:35Z",
  "start_commit": "dcac485bfde60fd7c65e48587a29d503513291f4",
  "result_commit": "dcac485bfde60fd7c65e48587a29d503513291f4",
  "outcome": "completed",
  "inputs": {
    "task": {
      "path": "requirements/SR-011.md",
      "sha256": "3297c6c0e1e72609058d8cbbe0f2e0724a0c432ee6573ef7c720fd58cc70835c"
    },
    "requirements": [
      {
        "id": "SR-011",
        "path": "requirements/SR-011.md",
        "sha256": "3297c6c0e1e72609058d8cbbe0f2e0724a0c432ee6573ef7c720fd58cc70835c"
      }
    ],
    "factory_config_sha256": "9912dde1358bbe5983bbfe18f52bb2050ebd1db9cfbf8579ead6c7e906b7d6c6"
  },
  "dependencies": [
    {
      "name": "candidate-tree",
      "kind": "git-tree",
      "digest": "git-tree:696efbc3bd0bdd96dfba00d99950411414d1304c",
      "source": "dcac485bfde60fd7c65e48587a29d503513291f4"
    },
    {
      "name": "factory-config",
      "kind": "file",
      "digest": "sha256:9912dde1358bbe5983bbfe18f52bb2050ebd1db9cfbf8579ead6c7e906b7d6c6",
      "source": ".factory/factory.yaml"
    },
    {
      "name": "pytest",
      "kind": "tool",
      "digest": "sha256:bb38606a229a7db4c4d63014617a1d96a8280d40158c6aa519701f44556252f0",
      "source": "pytest 9.1.1"
    },
    {
      "name": "requirement:SR-011",
      "kind": "file",
      "digest": "sha256:3297c6c0e1e72609058d8cbbe0f2e0724a0c432ee6573ef7c720fd58cc70835c",
      "source": "requirements/SR-011.md"
    }
  ],
  "implementation": {
    "changed_files": [],
    "patch": {
      "sha256": "e3b0c44298fc1c149afbf4c8996fb92427ae41e4649b934ca495991b7852b855",
      "size": 0,
      "media_type": "text/x-diff",
      "local": true,
      "publication": "local",
      "uri": null
    }
  },
  "validation": [
    {
      "command": "rtk proxy uv run pytest -v -o addopts=\"\" tests/unit/trace/test_model_edges.py::test_task_declares_source_plan_and_satisfies tests/unit/trace/test_model_edges.py::test_scalar_satisfies_is_accepted_as_single_edge tests/unit/trace/test_model_edges.py::test_task_justification_corrects_produces_a_typed_edge tests/unit/trace/test_model_edges.py::test_task_justification_mixed_kinds_produce_their_own_edges tests/unit/substrate/ledger/test_tasks_justification.py::test_legacy_satisfies_becomes_typed_justification tests/unit/substrate/ledger/test_tasks_justification.py::test_explicit_justification_corrects tests/unit/substrate/ledger/test_tasks_justification.py::test_justification_mixed_kinds tests/unit/substrate/ledger/test_tasks_justification.py::test_unknown_justification_kind_raises tests/unit/substrate/ledger/test_tasks_justification.py::test_multi_key_justification_entry_raises tests/unit/trace/test_model_nodes.py::test_task_with_unsupported_justification_kind_degrades_to_a_scope_error tests/unit/trace/test_model_nodes.py::test_task_with_well_formed_justification_has_no_scope_error tests/unit/trace/test_model_nodes.py::test_task_with_multi_key_justification_entry_degrades_to_a_scope_error",
      "started_at": "2026-09-03T00:30:30Z",
      "ended_at": "2026-09-03T00:30:35Z",
      "exit_code": 0,
      "summary": "12 passed in 0.82s",
      "requirements": [
        {
          "id": "SR-011",
          "passed": true,
          "command": "rtk proxy uv run pytest -v -o addopts=\"\" tests/unit/trace/test_model_edges.py tests/unit/substrate/ledger/test_tasks_justification.py tests/unit/trace/test_model_nodes.py",
          "note": "Newly-bound acceptance criteria (AC-1..AC-4), all kind:test_marker. `rtk proxy uv run coherence measurement run --satisfies SR-011` was tried first per process and returned an empty requirements list (measurement's harness-based runner only evaluates top-level `binding:` requirements, not kind:test_marker acceptance criteria -- confirmed by inspecting the SR-009/SR-010 precedent evidence, and this run itself overwrote validation/validation-report.json with an empty result, which was reverted via `git checkout -- validation/validation-report.json` before recording this entry), so evidence was recorded by directly collecting and running every criterion's referenced @pytest.mark.sr(\"SR-011\") test across the three ref files (tests/unit/trace/test_model_edges.py, tests/unit/substrate/ledger/test_tasks_justification.py, tests/unit/trace/test_model_nodes.py). All twelve marked tests passed and none failed.",
          "acceptance": [
            {
              "id": "AC-1",
              "tests": [
                "tests/unit/trace/test_model_edges.py::test_task_declares_source_plan_and_satisfies",
                "tests/unit/trace/test_model_edges.py::test_scalar_satisfies_is_accepted_as_single_edge",
                "tests/unit/trace/test_model_edges.py::test_task_justification_corrects_produces_a_typed_edge",
                "tests/unit/trace/test_model_edges.py::test_task_justification_mixed_kinds_produce_their_own_edges"
              ]
            },
            {
              "id": "AC-2",
              "tests": [
                "tests/unit/substrate/ledger/test_tasks_justification.py::test_legacy_satisfies_becomes_typed_justification",
                "tests/unit/substrate/ledger/test_tasks_justification.py::test_explicit_justification_corrects",
                "tests/unit/substrate/ledger/test_tasks_justification.py::test_justification_mixed_kinds"
              ]
            },
            {
              "id": "AC-3",
              "tests": [
                "tests/unit/trace/test_model_nodes.py::test_task_with_unsupported_justification_kind_degrades_to_a_scope_error",
                "tests/unit/trace/test_model_nodes.py::test_task_with_well_formed_justification_has_no_scope_error",
                "tests/unit/trace/test_model_nodes.py::test_task_with_multi_key_justification_entry_degrades_to_a_scope_error"
              ]
            },
            {
              "id": "AC-4",
              "tests": [
                "tests/unit/substrate/ledger/test_tasks_justification.py::test_unknown_justification_kind_raises",
                "tests/unit/substrate/ledger/test_tasks_justification.py::test_multi_key_justification_entry_raises"
              ]
            }
          ],
          "tests": [
            "tests/unit/trace/test_model_edges.py::test_task_declares_source_plan_and_satisfies",
            "tests/unit/trace/test_model_edges.py::test_scalar_satisfies_is_accepted_as_single_edge",
            "tests/unit/trace/test_model_edges.py::test_task_justification_corrects_produces_a_typed_edge",
            "tests/unit/trace/test_model_edges.py::test_task_justification_mixed_kinds_produce_their_own_edges",
            "tests/unit/substrate/ledger/test_tasks_justification.py::test_legacy_satisfies_becomes_typed_justification",
            "tests/unit/substrate/ledger/test_tasks_justification.py::test_explicit_justification_corrects",
            "tests/unit/substrate/ledger/test_tasks_justification.py::test_justification_mixed_kinds",
            "tests/unit/substrate/ledger/test_tasks_justification.py::test_unknown_justification_kind_raises",
            "tests/unit/substrate/ledger/test_tasks_justification.py::test_multi_key_justification_entry_raises",
            "tests/unit/trace/test_model_nodes.py::test_task_with_unsupported_justification_kind_degrades_to_a_scope_error",
            "tests/unit/trace/test_model_nodes.py::test_task_with_well_formed_justification_has_no_scope_error",
            "tests/unit/trace/test_model_nodes.py::test_task_with_multi_key_justification_entry_degrades_to_a_scope_error"
          ]
        }
      ]
    }
  ],
  "reviews": [],
  "decisions": [],
  "publication": {
    "state": "local",
    "errors": []
  }
}
