{
  "schema_version": 2,
  "run_id": "RUN-001",
  "task_id": "T-001",
  "started_at": "2026-08-01T00:00:00Z",
  "ended_at": "2026-08-01T01:00:00Z",
  "start_commit": "aaaaaaaaaaaaaaaaaaaaaaaaaaaaaaaaaaaaaaaa",
  "result_commit": "bbbbbbbbbbbbbbbbbbbbbbbbbbbbbbbbbbbbbbbb",
  "outcome": "completed",
  "inputs": {
    "task": {
      "path": "tasks/T-001.md",
      "sha256": "0000000000000000000000000000000000000000000000000000000000000000"
    },
    "requirements": [],
    "factory_config_sha256": "0000000000000000000000000000000000000000000000000000000000000000"
  },
  "implementation": {
    "changed_files": [
      "src/demo/feature.py"
    ],
    "patch": {
      "sha256": "0000000000000000000000000000000000000000000000000000000000000000",
      "size": 0,
      "media_type": "application/json"
    }
  },
  "dependencies": [],
  "validation": [],
  "reviews": [],
  "decisions": [],
  "publication": {
    "state": "local",
    "errors": []
  }
}